{
  "broadcaster": {
    "is_anonymous": false,
    "user_id": 123456789,
    "username": "test_streamer",
    "is_verified": false,
    "profile_picture": "https://example.invalid/kick-sim/test_streamer.png",
    "channel_slug": "test-streamer"
  },
  "is_live": true,
  "title": "Kick Sim test stream",
  "started_at": "{{ now() }}",
  "ended_at": null
}
